{
  "$schema": "http://json-schema.org/draft-04/schema#",
  "type": "object",
  "properties": {
    "_id": {
      "type": "object",
      "properties": {
        "$oid": {
          "type": "string"
        }
      },
      "required": ["$oid"]
    },
    "createdAt": {
      "type": "object",
      "properties": {
        "$date": {
          "type": "string"
        }
      },
      "required": ["$date"]
    },
    "updatedAt": {
      "type": "object",
      "properties": {
        "$date": {
          "type": "string"
        }
      },
      "required": ["$date"]
    },
    "user": {
      "type": "object",
      "properties": {
        "email": {
          "type": "string"
        },
        "affiliation": {
          "type": "string"
        }
      },
      "required": ["email", "affiliation"]
    },
    "project": {
      "type": "object",
      "properties": {
        "name": {
          "type": "string"
        },
        "description": {
          "type": "string"
        },
        "label": {
          "type": "string"
        }
      },
      "required": ["name", "description", "label"]
    },
    "process": {
      "type": "object",
      "properties": {
        "isExperiment": {
          "type": "boolean"
        },
        "isSimulation": {
          "type": "boolean"
        },
        "parameters": {
          "type": "array",
          "items": [
            {
              "type": "object",
              "properties": {
                "name": {
                  "type": "string"
                },
                "type": {
                  "type": "string"
                },
                "value": {
                  "type": "number"
                }
              },
              "required": ["name", "type", "value"]
            }
          ]
        },
        "calculation": {
          "type": "object",
          "properties": {
            "method": {
              "type": "string"
            },
            "swAgent": {
              "type": "object",
              "properties": {
                "name": {
                  "type": "string"
                },
                "version": {
                  "type": "string"
                }
              },
              "required": ["name", "version"]
            }
          },
          "required": ["method", "swAgent"]
        },
        "experiment": {
          "type": "object",
          "properties": {
            "method": {
              "type": "string"
            },
            "swAgent": {
              "type": "object",
              "properties": {
                "name": {
                  "type": "string"
                },
                "version": {
                  "type": "string"
                }
              },
              "required": ["name", "version"]
            }
          },
          "required": ["method", "swAgent"]
        },
        "material": {
          "type": "object",
          "properties": {
            "formula": {
              "type": "string"
            },
            "elements": {
              "type": "array",
              "items": [
                {
                  "type": "string"
                },
                {
                  "type": "string"
                }
              ]
            },
            "chemicalComposition": {
              "type": "array",
              "items": [
                {
                  "type": "object",
                  "properties": {
                    "element": {
                      "type": "string"
                    },
                    "percentage": {
                      "type": "string"
                    }
                  },
                  "required": ["element", "percentage"]
                }
              ]
            },
            "input": {
              "type": "object",
              "properties": {
                "lattice": {
                  "type": "object",
                  "properties": {
                    "a": {
                      "type": "string"
                    },
                    "b": {
                      "type": "string"
                    },
                    "c": {
                      "type": "string"
                    },
                    "alpha": {
                      "type": "string"
                    },
                    "beta": {
                      "type": "string"
                    },
                    "gamma": {
                      "type": "string"
                    }
                  },
                  "required": ["a", "b", "c", "alpha", "beta", "gamma"]
                },
                "sites": {
                  "type": "string"
                },
                "species": {
                  "type": "string"
                }
              },
              "required": ["lattice", "sites", "species"]
            },
            "output": {
              "type": "object",
              "properties": {
                "lattice": {
                  "type": "object",
                  "properties": {
                    "a": {
                      "type": "string"
                    },
                    "b": {
                      "type": "string"
                    },
                    "c": {
                      "type": "string"
                    },
                    "alpha": {
                      "type": "string"
                    },
                    "beta": {
                      "type": "string"
                    },
                    "gamma": {
                      "type": "string"
                    }
                  },
                  "required": ["a", "b", "c", "alpha", "beta", "gamma"]
                },
                "sites": {
                  "type": "string"
                },
                "species": {
                  "type": "string"
                }
              },
              "required": ["lattice", "sites", "species"]
            }
          },
          "required": [
            "formula",
            "elements",
            "chemicalComposition",
            "input",
            "output"
          ]
        },
        "properties": {
          "type": "array",
          "items": [
            {
              "type": "object",
              "properties": {
                "name": {
                  "type": "string"
                },
                "type": {
                  "type": "string"
                },
                "axis": {
                  "type": "object",
                  "properties": {
                    "labelX": {
                      "type": "string"
                    },
                    "labelY": {
                      "type": "string"
                    }
                  },
                  "required": ["labelX", "labelY"]
                },
                "value": {
                  "type": "number"
                },
                "units": {
                  "type": "object",
                  "properties": {
                    "x": {
                      "type": "string"
                    },
                    "y": {
                      "type": "string"
                    }
                  },
                  "required": ["x", "y"]
                },
                "file": {
                  "type": "object",
                  "properties": {
                    "hash": {
                      "type": "string"
                    },
                    "extention": {
                      "type": "string"
                    },
                    "size": {
                      "type": "string"
                    },
                    "createdAt": {
                      "type": "object",
                      "properties": {
                        "$date": {
                          "type": "string"
                        }
                      },
                      "required": ["$date"]
                    },
                    "updatedAt": {
                      "type": "object",
                      "properties": {
                        "$date": {
                          "type": "string"
                        }
                      },
                      "required": ["$date"]
                    }
                  },
                  "required": [
                    "hash",
                    "extention",
                    "size",
                    "createdAt",
                    "updatedAt"
                  ]
                },
                "isCalculated": {
                  "type": "boolean"
                },
                "isPhysical": {
                  "type": "boolean"
                }
              },
              "required": [
                "name",
                "type",
                "axis",
                "value",
                "units",
                "file",
                "isCalculated",
                "isPhysical"
              ]
            }
          ]
        },
        "iemapID": {
          "type": "string"
        }
      },
      "required": [
        "isExperiment",
        "isSimulation",
        "parameters",
        "calculation",
        "experiment",
        "material",
        "properties",
        "iemapID"
      ]
    },
    "files": {
      "type": "array",
      "items": [
        {
          "type": "object",
          "properties": {
            "hash": {
              "type": "string"
            },
            "description": {
              "type": "string"
            },
            "name": {
              "type": "string"
            },
            "extention": {
              "type": "string"
            },
            "type": {
              "type": "string"
            },
            "isProcessed": {
              "type": "boolean"
            },
            "size": {
              "type": "string"
            },
            "createdAt": {
              "type": "object",
              "properties": {
                "$date": {
                  "type": "string"
                }
              },
              "required": ["$date"]
            },
            "updatedAt": {
              "type": "object",
              "properties": {
                "$date": {
                  "type": "string"
                }
              },
              "required": ["$date"]
            },
            "publication": {
              "type": "object",
              "properties": {
                "name": {
                  "type": "string"
                },
                "date": {
                  "type": "object",
                  "properties": {
                    "$date": {
                      "type": "string"
                    }
                  },
                  "required": ["$date"]
                },
                "url": {
                  "type": "string"
                }
              },
              "required": ["name", "date", "url"]
            }
          },
          "required": [
            "hash",
            "description",
            "name",
            "extention",
            "type",
            "isProcessed",
            "size",
            "createdAt",
            "updatedAt",
            "publication"
          ]
        }
      ]
    },
    "_v": {
      "type": "string"
    },
    "projectWP": {
      "type": "string"
    }
  },
  "required": [
    "_id",
    "createdAt",
    "updatedAt",
    "user",
    "project",
    "process",
    "files",
    "_v",
    "projectWP"
  ]
}
