{
  "_id": { "$oid": "6257b7bc85b638709d3335f0" },
  "createdAt": { "$date": "2022-04-13T22:08:00.000Z" },
  "updatedAt": { "$date": "2022-04-12T00:08:40.000Z" },
  "user": {
    "email": "nome.cognome@enea.it",
    "affiliation": "ENEA"
  },
  "project": {
    "name": "Progetto IEMAP1",
    "description": "Descrizione estesa",
    "label": "Descrizione breve"
  },

  "process": {
    "isExperiment": true,
    "isSimulation": true,
    "parameters": [{ "name": "param1", "type": "type 1", "value": 45465.9 }],
    "calculation": {
      "method": "method1",
      "swAgent": { "name": "Orcad", "version": "1.0.5" }
    },
    "experiment": {
      "method": "exp method 1",
      "swAgent": { "name": "software1", "version": "4.7" }
    },
    "material": {
      "formula": "fasjkhfgkasjhgf",
      "elements": ["Zn", "O"],
      "chemicalComposition": [{ "element": "O2", "percentage": "20%" }],
      "input": {
        "lattice": {
          "a": "11.050",
          "b": "10365",
          "c": "5.635",
          "alpha": "81.59",
          "beta": "68.114",
          "gamma": "30296"
        },
        "sites": "[ [x1,y1,z1], [x2, y2, z2], [x3, y3, z3] ]",
        "species": "[H,H,H]"
      },
      "output": {
        "lattice": {
          "a": "11.050",
          "b": "10365",
          "c": "5.635",
          "alpha": "81.59",
          "beta": "68.114",
          "gamma": "30296"
        },
        "sites": "[ [x1,y1,z1], [x2, y2, z2], [x3, y3, z3] ]",
        "species": "[H,H,H]"
      }
    },
    "properties": [
      {
        "name": "H2O",
        "type": "2D",
        "axis": { "labelX": "Wavelength", "labelY": "Transmittance" },
        "value": 255.89,
        "units": { "x": "UnitX", "y": "UnitY" },
        "file": {
          "hash": "owiuqpiqutp",
          "extention": "CSV",
          "size": "200Kb",
          "createdAt": { "$date": "2022-04-24T22:00:00.000Z" },
          "updatedAt": { "$date": "2022-04-24T22:00:00.000Z" }
        },
        "isCalculated": true,
        "isPhysical": true
      }
    ],
    "iemapID": "iemap-1"
  },
  "files": [
    {
      "hash": "jhfslajfhslakjhflkasjhfoiruy",
      "description": "Esperimento su batterie condotto con tecnica..",
      "name": "File esperimento 1",
      "extention": "pdf",
      "type": "[Code | Tabular | Image | Raw Instrument Data]",
      "isProcessed": false,
      "size": "10Mb",
      "createdAt": { "$date": "2022-04-13T22:00:00.000Z" },
      "updatedAt": { "$date": "2022-04-12T22:00:00.000Z" },
      "publication": {
        "name": "Research paper",
        "date": { "$date": "2022-04-30T22:00:00.000Z" },
        "url": "https://elsevier/fjhasgjhdf"
      }
    }
  ],
  "_v": "1.0",
  "projectWP": "WP Battery Test"
}
